id,0
7, choic utopian dystopian path like shape busi decad russia shut nord stream ga pipelin europ
14, plu renew scrutini crypto scam latest decentralis crypto blunder move come amid concern suppli russia europ could disrupt
18, analysi public messag show systemat misalign climat relat activ freeport termin close least three week europ seek cut depend russia
21, market question ft guid week ahead russia cut ga deliveri europ via nord stream
28, alarm high ga price could persist possibl russia cut ga suppli europ britain might immun shortag amid rise competit fuel
43, watchdog take action privat equiti group disclosur bn share sale execut freeport termin close least three week europ seek cut depend russia
51, technolog knowhow combat climat chang need galvanis action use russia cut ga suppli europ britain might immun shortag amid rise competit fuel
56, fuel return level reach shale drill boom lng export head europ russia invas ukrain forc rethink geopolit tension asia
58, plu renew scrutini crypto scam latest decentralis crypto blunder europ plan risk russia cut ga suppli year
68, feedback us regul propos includ concern compani forc activ passiv europ plan risk russia cut ga suppli year
69, ftc alleg detail million devic could use track user sensit place abort clinic move come amid concern suppli russia europ could disrupt
73, analyst say reopen countri tourism could herald shift currenc flow freeport termin close least three week europ seek cut depend russia
79, uk base group say restructur nearli bn debt leas burden dilut equiti interest freeport termin close least three week europ seek cut depend russia
85, novic investor better serv passiv fund say blue whale co founder freeport termin close least three week europ seek cut depend russia
97, german sport car brand seek luxuri valuat long await float russia cut ga deliveri europ via nord stream
99, plbuckland busi yet alreadi cheaper unreli french nuclear power along depend fossil fuel russia caus energi crisi europ
104, nasdaq index rack longest lose streak sinc job report fail dent feder reserv expect australia top lng group say unabl plug gap russia cut europ
109, maga vice bad etf would impact esg fund name rule chang adopt german told conserv energi russia cut ga flow europ
110, repurchas superb disciplin corpor financ encourag german told conserv energi russia cut ga flow europ
115, regul say measur requir reduc consum harm russia cut ga suppli europ britain might immun shortag amid rise competit fuel
129, least us argu goldman sach russia cut ga deliveri europ via nord stream
130, consolid offer benefit client partner employe say jay horgen freeport termin close least three week europ seek cut depend russia
132, clean fuel investor favour biden plan unless brussel improv incent fortescu chief claim australia top lng group say unabl plug gap russia cut europ
141, chenier lng turbin longer exempt regul airborn carcinogen russia shut nord stream ga pipelin europ
146, ethereum switch greener system seen crypto enthusiast long await chanc prove critic wrong freeport termin close least three week europ seek cut depend russia
147, fuel return level reach shale drill boom lng export head europ plan come russia putin warn reduc suppli contin
157, fuel return level reach shale drill boom lng export head europ russia wane relianc london market reduc bite uk sanction
162, blacklist compani valu driven invest appear larg symbol australia top lng group say unabl plug gap russia cut europ
179, fuel return level reach shale drill boom lng export head europ shell start talk nightmar russia exit
217, price cap herald rise bill winter there time wast freeport termin close least three week europ seek cut depend russia
226, fuel return level reach shale drill boom lng export head europ esg investor respond russia invas ukrain
238, choic utopian dystopian path like shape busi decad russia cut ga suppli europ britain might immun shortag amid rise competit fuel
256, industri warn soar cost heat greenhous energi intens process lead shortag russia cut ga deliveri europ via nord stream
259, system peg electr price ga fit purpos freeport termin close least three week europ seek cut depend russia
261, analyst caution price remain elev volatil go winter freeport termin close least three week europ seek cut depend russia
297, europ turn lng instead russia ga impact climat
298, sinc russia invas ukrain competit lng becom intens europ need vast amount help replac russian pipelin ga use make almost contin import read energynewsmonitor
331, explainedclim europ turn lng instead russia ga impact climat
